title,tag,area,dd,price
金隅万科城二期 满五唯一 采光好 视野开阔 随时看房,必看好房,金隅万科城二期 ,鼓楼大街,399
万科天空之城 南北通透 婚房装修 好楼层 拎包入住,必看好房,龙兴园北区 ,回龙观,475
瀛海家园融园D区、边户南北通透电梯两居室。,必看好房,瀛海家园融园D区 ,瀛海,325
方恒东景 2012年新社区 近地铁 有电梯 35%绿化,必看好房,方恒东景 ,临河里,389
【首付110万】【四环小三居】【着急出售】随时看房,必看好房,看丹路4号院 ,科技园区,285
玉林东里二区双南向二居室，户型方正，采光好,必看好房,玉林东里二区 ,右安门外,428
五里店南里低楼层，带明厅小三居。,必看好房,五里店南里 ,五里店,299
劲松南路    南向一居室    大客厅    采光好,必看好房,劲松南路 ,劲松,335
方庄南路18号院 东南正规两居室,必看好房,方庄南路18号院 ,成寿寺,436
六里屯北里近地铁全明格局三居！中间楼层不临街！,必看好房,六里屯北里 ,甜水园,448
马连道中里三区，朝南三室一厅，满五年房改房，没遮挡,必看好房,马连道中里 ,马连道,880
视野开阔，采光好风景房一览无余，俯瞰运河，电梯房,必看好房,合生滨江帝景一期 ,玉桥,575
兴海家园星苑     南北通透三居室,必看好房,兴海家园星苑 ,西红门,495
嘉铭桐城C区 东南两居室 满五年唯一 诚意出售,必看好房,嘉铭桐城C区 ,亚运村小营,939
滨河西里南区97年的房子不把边不临街4层满五唯一,必看好房,滨河西里南区 ,枣园,243
满五年唯一，南向2居，高层观景，自住精装，诚意出售,必看好房,北京新天地一期 ,常营,585
力源里 正规两居 满五年 楼层高 视野棒 采光好,必看好房,力源里 ,四惠,460
南苑北里三区，东西通透三居，诚心出售，随时看房,必看好房,南苑北里三区 ,和义,273
劲松磨房北里10号线14号线 明厅两居 南北通透 满五年,必看好房,磨房北里 ,北工大,397
对小区花园视野好，采光好，户型方正，业主诚意出售。,必看好房,国美第一城2号院 ,朝青,650
石景嘉园东南一居  正规一室一厅  满五年唯一  精装修,必看好房,石景嘉园 ,八角,208
富力盛悦居 南北通透三居室 一梯两户 电梯洋房,必看好房,富力盛悦居 ,旧宫,755
恒基中心 2室1厅 东,必看好房,恒基中心 ,建国门内,790
丰台区 蒲安西里 中间楼层 精装修 有正规客厅户型,必看好房,蒲安西里 ,蒲黄榆,382
人车分流 绿化30% 电梯洋房一梯二户,必看好房,首开香溪郡 ,通州其它,378
店长推荐，中高楼层电梯房，交通便利，配套齐全,必看好房,刘家窑东里 ,蒲黄榆,450
积水潭地铁300米 中间层两居  看房方便诚意出售,必看好房,新外大街31号院 ,小西天,452
正规一室一厅，窗外对着小区里边安静舒适,必看好房,远洋山水 ,鲁谷,519
小区楼龄新，人车分流车位充足，正规两居室，拎包入住,必看好房,庚坊国际 ,北太平庄,550
海子角南里 满五唯一 楼层好 视野佳,必看好房,海子角南里 ,观音寺,226
育新花园北里，房子楼层好产权清晰。,必看好房,育新花园北里 ,大兴新机场洋房别墅区,188
裕龙花园一区 南北通透 带阳台，西边窗，满五唯一,必看好房,裕龙一区 ,顺义城,390
近地铁经典正规一居室，商圈配套齐全，业主靠谱出售,必看好房,金隅丽景园 ,常营,226
定福家园3号院 3室1厅 南 北,必看好房,定福家园3号院 ,定福庄,560
东直门外柳芳南里正规大一居室，采光好，视野好,必看好房,柳芳南里 ,国展,420
燕山水泥厂 2室2厅 南 北,必看好房,燕山水泥厂 ,石景山其它,263
六营门，低楼层，南北两居室，精装修,必看好房,六营门小区 ,万源,370
十佳物业2层两居南北通透采光视野好适合有老人家庭,必看好房,望都新地 ,北七家,378
芳源里  南北通透  电梯两居 全明户型,必看好房,芳源里 ,旧宫,440
五矿家属楼，中间层，费用少，交通便利,必看好房,西三环北路23号院 ,厂洼,640
南中轴 康泽园 2000年商品房 满五唯一 明厅,必看好房,康泽园 ,赵公口,523
住欣家园东区 正规两居室 草房地铁站,必看好房,住欣家园 ,常营,300
此房满五唯一，装修花了25万左右，集中供暖，近地铁,必看好房,鸿顺园西区 ,良乡,279
玺源台 2室1厅 西,必看好房,玺源台 ,广安门,826
小关北里新上，南北通透，满五唯一，精装修,必看好房,小关北里 ,惠新西街,550
无遮挡 采光好 精装修 全南向 格局方正视野好,必看好房,北京经开壹中心 ,亦庄,328
六里屯北里近地铁全明格局三居！中间楼层不临街！,必看好房,六里屯北里 ,甜水园,448
青年汇佳园二期 业主诚意出售 户型方正,必看好房,青年汇佳园 ,朝青,576
大方居满五唯一商品房东西通透楼层视野好配套齐全,必看好房,大方居 ,九棵树(家乐福),298
龙德嘉园优质两居室，满五年唯一精装修，诚心出售,必看好房,杨庄北区 ,杨庄,405
海特花园1999年，精装修，南北通透，满五年唯一,必看好房,海特花园西区 ,苹果园,405
此房三面朝南，采光充足，户型方正居住舒适,必看好房,远洋一方润园6号院 ,双桥,365
开阳里五区 南北通透 中间楼层 优质两居 满五年唯一,必看好房,开阳里五区 ,北京南站,520
东城区 景泰东里 东向一居室 近地铁 有电梯,必看好房,景泰东里 ,蒲黄榆,480
gogo新世代高楼层朝西一居室，精装修，楼下双地铁,必看好房,gogo新世代 ,方庄,308
玉桥北里，低楼层两居室，诚心出售，随时看房随时签约,必看好房,玉桥北里 ,乔庄,214
美然动力A3区，集中供暖，6号线褡裢坡，南北通透,必看好房,美然动力A3区 ,定福庄,400
京品小区 1室1厅 东北,必看好房,京品小区 ,西罗园,420
